[
  {
    "$schema": "./series.schema.json",
    "id": "vscode-docker-setup",
    "title": "VS Code + Docker for a small team",
    "slug": "vscode-docker-setup",
    "description": "Best practices for small teams. Unified coding, minimal host libraries installations",
    "publishedAt": "2026-01-01",
    "updatedAt": "2026-04-01",
    "order": [
      "vscode-docker-intro",
      "vscode-docker-pt1",
      "vscode-docker-pt2",
      "vscode-docker-pt3",
      "vscode-docker-pt4",
      "vscode-docker-pt1-short",
      "vscode-docker-pt2-short",
      "vscode-docker-pt3-short",
      "vscode-docker-pt4-short"
    ],
    "status" :  "active"
  },
  {
    "$schema": "./series.schema.json",
    "id": "ai-instructions",
    "title": "AI Structured Instructions",
    "slug": "ai-instructions",
    "description": "How can we change the AI behavior in order to have better results, fine-tune to our needs",
    "publishedAt": "2026-04-01",
    "updatedAt": "2026-07-01",
    "order": [
      "ai-instructions-pt1",
      "ai-instructions-pt2",
      "ai-instructions-pt3"
    ],
    "status" :  "active"
  }
]